8000500269589		fr								Nutella biscuits																																			Ferrero	ferrero						France, Suisse	en:france,en:switzerland			0																		"pâte à tartiner aux NOISETTES et au cacao 40% (sucre, huile de palme, NOISETTES 13%, cacao maigre 7,4%' LAIT écrémé en poudre 6,6%, LACTOSÉRUM en poudre, émulsifiants : lécithines [SOJA, vanilline), farine de FROMENT 27,5%, sucre de canne 9%, LAIT frais pasteurisé, farine de FROMENT intégrale 6%, huile de mais. BEURRE concentré, huile de palmiste, LACTOSE, extrait liquide de malt d'ORGE et de maist miel, poudres à lever (disphosfate disodique, carbonate acide de sodium, carbonate acide d'ammonium), cacao maigre, sel, amidon de FROMENT, sucre, extrait de malt d'ORGE en poudre, émulsifiants : lécithines (SOJA] ; vanilline. Peut ŒUF, AMANDES, NOIX et PISTACHES"												"Œufs, Gluten, Lait, Fruits à coque, Soja"	en:eggs,en:gluten,en:milk,en:nuts,en:soybeans				100g	100g			515	kcal	24.7		9.9		63.5		35.9		0		8		0.6		0.24	g			515	kcal																																																																																			4	en:4-ultra-processed-food-and-drink-products	unknown		unknown		1		-5	-15	1	0	-10															App - yuka, Apps
80761006		fr								Nutella																															750g	15g			Ferrero	ferrero		"Snacks, Petit-déjeuners, Produits à tartiner, Snacks sucrés, Produits à tartiner sucrés, Pâtes à tartiner, Pâtes à tartiner aux noisettes, Pâtes à tartiner au chocolat, Pâtes à tartiner aux noisettes et au cacao"	en:snacks,en:breakfasts,en:spreads,en:sweet-snacks,en:sweet-spreads,fr:pates-a-tartiner,en:hazelnut-spreads,en:chocolate-spreads,en:cocoa-and-hazelnuts-spreads			France	en:france	Super U	super-u	0																		sucre, huile de palme, noisettes 13%, lait écrémé en poudre 8,7%, cacao maigre 7,4%, émulsifiants : lécithine [ SOJA]												"Fruits à coque, Soja"	en:nuts,en:soybeans				100g	100g			539	kcal	30.9	g	10.6	g	57.5	g	56.3	g			6.3	g	0.107	g	0.0428	g			539	kcal																																																																																	en:sweets	en:sugary-snacks,en:sweets	4	en:4-ultra-processed-food-and-drink-products	e	26	d	20	1	31032	-5	-15	1	0	-10															
3017620420467		fr								Nutella Coffret																																			Ferrero, Nutella	ferrero,nutella						France	en:france			0																		Sucre, huile de palme, noisettes 13%, lait écrémé en poudre 8,7%, cacao maigre 7,4%, émulsifiants : lécithines [soja] ; vanilline.												"Lait, Fruits à coque, Soja"	en:milk,en:nuts,en:soybeans				100g	100g	2252	kJ			30.9	g	10.6	g	57.5	g	56.3	g			6.3	g	0.107	g	0.0428	g			2252	kJ																																																																																			4	en:4-ultra-processed-food-and-drink-products	unknown		unknown		1		-5	-15	1	0	-10															Producer - Ferrero, Producers
8000500257791		fr								B-ready																															19.1 g				Nutella, Ferrero, Nutella B-Ready	nutella,ferrero,nutella-b-ready		Snacks, Snacks sucrés, Biscuits et gâteaux, Biscuits, Biscuits au chocolat	en:snacks,en:sweet-snacks,en:biscuits-and-cakes,en:biscuits,en:chocolate-biscuits			France	en:france			0																		"Pâte à tartiner aux noisettes et au cacao nutella 76% (sucre, huile de palme,noisettes 13%, cacao maigre 7,4%, lait écrémé en poudre 6,6%, lactoserum en poudre, émulsifiants : lécithines [soja], vanilline), spécialité croustillante et éclats croustillants 24% (farine de froment, huile de palme, levure de bière, extrait de malt d'orge, émulsifiants : lécithines [soja], sel, lait écrémé en poudre, protéines de froment, protéines de lait)."												"Gluten, Lait, Fruits à coque, Soja"	en:gluten,en:milk,en:nuts,en:soybeans				100g	100g	2083	kJ			23.9	g	7.9	g	60.4	g	42.7	g			8.3	g	0.56	g	0.224	g			2083	kJ																																																																																	en:biscuits-and-cakes	en:sugary-snacks,en:biscuits-and-cakes	4	en:4-ultra-processed-food-and-drink-products	e	24	d	26	1	24036	-5	-15	1	0	-10															Producer - Ferrero, Producers, App - Yuka, Apps
3017620421044		fr								Nutella																															825 g	15 g	Plastique, Verre, Bocal, Couvercle, Couvercle en plastique, Opercule aluminium, Pot en verre	en:plastic,en:glass,en:jar,en:lid,fr:couvercle-en-plastique,fr:opercule-aluminium,fr:pot-en-verre	Ferrero,Nutella	ferrero,nutella		"Petit-déjeuners, Produits à tartiner, Produits à tartiner sucrés, Pâtes à tartiner, Pâtes à tartiner aux noisettes, Pâtes à tartiner au chocolat, Pâtes à tartiner aux noisettes et au cacao"	en:breakfasts,en:spreads,en:sweet-spreads,fr:pates-a-tartiner,en:hazelnut-spreads,en:chocolate-spreads,en:cocoa-and-hazelnuts-spreads	en:Sustainable, Sans gluten, Huile de palme durable, Point Vert, RSPO	en:sustainable,en:no-gluten,en:sustainable-palm-oil,en:green-dot,en:roundtable-on-sustainable-palm-oil	France, Martinique, Maurice	en:france,en:martinique,en:mauritius			0																		Sucre, huile de palme, noisettes 13%, cacao maigre 7,4%, lait écrémé en poudre 6,6%, lactosérum en poudre, émulsifiants : lécithines [soja], vanilline.												"Lait, Fruits à coque, Soja"	en:milk,en:nuts,en:soybeans				100g	100g	2278	kJ	546	kcal	31.6	g	11	g	57.6	g	56.8	g			6	g	0.114	g	0.0456	g			2278	kJ																																												en:lid	en:plastic					en:seal	en:aluminium					en:pot	en:glass					en:jar																			en:sweets	en:sugary-snacks,en:sweets	4	en:4-ultra-processed-food-and-drink-products	e	26	d	31		31032	-5	-14	0	0																Producer - Ferrero, Producers, App - yuka, Apps
8000500275924		fr								Nutella Ferrero																																	Couvercle en plastique, Opercule aluminium, Pot en verre	fr:couvercle-en-plastique,fr:opercule-aluminium,fr:pot-en-verre	Ferrero,Nutella	ferrero,nutella		"Petit-déjeuners, Produits à tartiner, Produits à tartiner sucrés, Pâtes à tartiner, Pâtes à tartiner aux noisettes, Pâtes à tartiner au chocolat, Pâtes à tartiner aux noisettes et au cacao"	en:breakfasts,en:spreads,en:sweet-spreads,fr:pates-a-tartiner,en:hazelnut-spreads,en:chocolate-spreads,en:cocoa-and-hazelnuts-spreads	en:Sustainable, Huile de palme durable, RSPO	en:sustainable,en:sustainable-palm-oil,en:roundtable-on-sustainable-palm-oil	Belgique, France	en:belgium,en:france			0																		Sucre, huile de palme, NOISETTES 13%, LAIT écrémé en poudre cacao maigre 8,7%, cacao maigre 7,4%, émulsifiants : lécithines [SOJA] ; vanilline.												"Lait, Fruits à coque, Soja"	en:milk,en:nuts,en:soybeans				100g	100g			539	kcal	30.9		10.6		57.5		56.3				6.3		0.107		0.0428	g			539	kcal																																												en:lid	en:plastic					en:seal	en:aluminium					en:pot	en:glass																								en:sweets	en:sugary-snacks,en:sweets	4	en:4-ultra-processed-food-and-drink-products	e	26	c	41		31032	-5	-4	0	0																App - yuka, Apps
80051640		fr								Nutella																															750 g e	15g	Plastique, Verre, Bocal	en:plastic,en:glass,en:jar	Ferrero	ferrero		"Petit-déjeuners, Produits à tartiner, Produits à tartiner sucrés, Pâtes à tartiner, Pâtes à tartiner aux noisettes, Pâtes à tartiner au chocolat, Pâtes à tartiner aux noisettes et au cacao"	en:breakfasts,en:spreads,en:sweet-spreads,fr:pates-a-tartiner,en:hazelnut-spreads,en:chocolate-spreads,en:cocoa-and-hazelnuts-spreads			Belgique, France, Luxembourg	en:belgium,en:france,en:luxembourg			0													Zucker, pflanzliches Fett (Palmöl), _Haselnüsse_ 13%, fettarmer Kakao, _Magermilchpulver_ 6, 6 %, _Süssmolkepulver_, Emulgator (Sojalecithin), Vanillin		sugar, palm oil, noisettes 13% milk skimmed powder 8.7%, lean cocoa 7.4%, emulsifiers: lecithins [sojai			Sucre, huile de palme, NOISETTES 13%, LAIT écrémé en poudre 8,7%, cacao maigre 7,4%, émulsifiants : lécithines [SOJA]; vanilline.												"Lait, Fruits à coque, Soja"	en:milk,en:nuts,en:soybeans				100g	100g			539	kcal	30.9	g	10.6	g	57.5	g	56.3	g			6.3	g	0.107	g	0.0428	g			539	kcal																																							13	g				en:jar	en:plastic						en:glass																														en:sweets	en:sugary-snacks,en:sweets	4	en:4-ultra-processed-food-and-drink-products	e	26	d	23		31032	-5	-12	1	0	-10															App - yuka, Apps, App - InFood
8000500282809	2014	fr								NUTELLA B-READY biscuits 440g paquet de 20 pièces																					"Spécialité croustillante fourrée à la pâte à tartiner aux noisettes et au cacao NUTELLA et aux éclats croustillants"										440 g	22 g (22)	Boîte	en:box	Ferrero, Nutella b-ready	ferrero,nutella-b-ready						France	en:france			0																		"Pâte à tartiner aux noisettes et au cacao 81,5 % (sucre, huile de palme, noisettes 13%, lait écrémé en poudre 8,7%, cacao maigre 7,4%, émulsifiants : lécithines [soja] ; vanilline), farine de froment 16%, levure de bière, extrait de malt d'orge, sel, lait écrémé en poudre, émulsifiants : lécithines [soja] ; protéines de froment, protéines de lait, eau."												"Gluten, Lait, Fruits à coque, Soja"	en:gluten,en:milk,en:nuts,en:soybeans			false	100g		2177	kJ	521	kcal	27	g	9.5	g	60.7	g	47.1	g			7.2	g	0.559	g	0.2236	g			2177	kJ																																												en:box																																		"A conserver au sec et à l'abri de la chaleur"	FERRERO FRANCE COMMERCIALE - Service Consommateurs, CS 90058 - 76136 MONT SAINT AIGNAN Cedex				4	en:4-ultra-processed-food-and-drink-products	unknown		unknown				-5	-10	0	0	-10							3010176200101	10000045	Chocolat et Confiserie de Chocolat et/ou de Sucre - Confiserie	true	2021-03-10T11:49:46+01:00	FERRERO FRANCE COMMERCIALE	2014	2021-03-10T11:49:46+01:00	Producer - Ferrero, Producers, App - yuka, Apps, Producer - ferrero-france-commerciale
3017620420009		fr								Nutella																															950 g	15 g	Verre, Pot, Couvercle en plastique, Opercule aluminium, Pot en verre	en:glass,en:pot,fr:couvercle-en-plastique,fr:opercule-aluminium,fr:pot-en-verre	Ferrero,Nutella	ferrero,nutella		"Petit-déjeuners, Produits à tartiner, Produits à tartiner sucrés, Pâtes à tartiner, Pâtes à tartiner aux noisettes, Pâtes à tartiner au chocolat, Pâtes à tartiner aux noisettes et au cacao"	en:breakfasts,en:spreads,en:sweet-spreads,fr:pates-a-tartiner,en:hazelnut-spreads,en:chocolate-spreads,en:cocoa-and-hazelnuts-spreads	en:Sustainable, Sans gluten, Huile de palme durable, Point Vert, RSPO	en:sustainable,en:no-gluten,en:sustainable-palm-oil,en:green-dot,en:roundtable-on-sustainable-palm-oil	France	en:france			0																		Sucre, huile de palme, noisettes 13%, cacao maigre 7,4%, lait écrémé en poudre 6,6%, lactoserum en poudre, émulsifiants : lécithines [soja], vanilline.												"Lait, Fruits à coque, Soja"	en:milk,en:nuts,en:soybeans				100g	100g	2278	kJ	539	kcal	30.9	g	10.6	g	57.5	g	56.3	g	0	g	6.3	g	0.1075	g	0.043	g			2278	kJ																																							13	g				en:lid	en:plastic					en:seal	en:aluminium					en:pot	en:glass																								en:sweets	en:sugary-snacks,en:sweets	4	en:4-ultra-processed-food-and-drink-products	e	26	c	41		31032	-5	-4	0	0																Producer - Ferrero, Producers, App - yuka, Apps
3017620425400		fr								Nutella																					"Pâte à tartiner aux noisettes"										750 g		Plastique, Verre, Bocal, Couvercle, Couvercle en plastique, Opercule aluminium, Pot en verre	en:plastic,en:glass,en:jar,en:lid,fr:couvercle-en-plastique,fr:opercule-aluminium,fr:pot-en-verre	Nutella,Ferrero	nutella,ferrero		"Petit-déjeuners, Produits à tartiner, Produits à tartiner sucrés, Pâtes à tartiner, Pâtes à tartiner aux noisettes, Pâtes à tartiner au chocolat, Pâtes à tartiner aux noisettes et au cacao"	en:breakfasts,en:spreads,en:sweet-spreads,fr:pates-a-tartiner,en:hazelnut-spreads,en:chocolate-spreads,en:cocoa-and-hazelnuts-spreads	en:Sustainable, Huile de palme durable, RSPO	en:sustainable,en:sustainable-palm-oil,en:roundtable-on-sustainable-palm-oil	France, Suisse	en:france,en:switzerland			0																		Sucre, Huile de palme, NOISETTES 13%, LAIT écrémé en poudre 8,7%, cacao maigre 7,4%, émulsifiant : lécithine (SOJA), vanilline.												"Lait, Fruits à coque, Soja"	en:milk,en:nuts,en:soybeans				100g	100g	2273	kJ			31.6	g	10.9	g	57.3	g	56.7	g	3.4	g	6	g	0.09398	g	0.037592	g			2273	kJ																																												en:lid	en:plastic					en:seal	en:aluminium					en:pot	en:glass					en:jar																		http://www.ferrero.fr/nutella	en:sweets	en:sugary-snacks,en:sweets	4	en:4-ultra-processed-food-and-drink-products	e	23	d	31		31032	-5	-14	0	0																
3017624047509		fr								Nutella																					Pate Tartiner Nutella										750g		Couvercle en plastique, Opercule aluminium, Pot en verre	fr:couvercle-en-plastique,fr:opercule-aluminium,fr:pot-en-verre	Nutella,ferrero	nutella,ferrero		"Petit-déjeuners, Produits à tartiner, Produits à tartiner sucrés, Pâtes à tartiner"	en:breakfasts,en:spreads,en:sweet-spreads,fr:pates-a-tartiner	en:Sustainable, Huile de palme durable, RSPO	en:sustainable,en:sustainable-palm-oil,en:roundtable-on-sustainable-palm-oil	France	en:france			0																		Sucre, Huile de palme, NOISETTES 13%, LAIT écrémé en poudre 8,7%, cacao maigre 7,4%, émulsifiant : lécithine (SOJA), vanilline.												"Lait, Fruits à coque, Soja"	en:milk,en:nuts,en:soybeans				100g	100g			530	kcal	31	g	10	g	56	g	55	g	4	g	6.8	g	0.03	g	0.012	g			530	kcal																																												en:lid	en:plastic					en:seal	en:aluminium					en:pot	en:glass																								en:sweets	en:sugary-snacks,en:sweets	4	en:4-ultra-processed-food-and-drink-products	e	21	unknown				-5	-4	0	0																App - yuka, Apps
8000500191163		fr								Nutella																					"Pâte à tartiner aux noisettes et au cacao"										350 g		Bocal, Couvercle en plastique, Opercule aluminium, Pot en verre	en:jar,fr:couvercle-en-plastique,fr:opercule-aluminium,fr:pot-en-verre	Ferrero,Nutella	ferrero,nutella		"Petit-déjeuners, Produits à tartiner, Produits à tartiner sucrés, Pâtes à tartiner, Pâtes à tartiner aux noisettes, Pâtes à tartiner au chocolat, Pâtes à tartiner aux noisettes et au cacao"	en:breakfasts,en:spreads,en:sweet-spreads,fr:pates-a-tartiner,en:hazelnut-spreads,en:chocolate-spreads,en:cocoa-and-hazelnuts-spreads	en:Sustainable, Huile de palme durable, Fabriqué en Italie, RSPO	en:sustainable,en:sustainable-palm-oil,en:made-in-italy,en:roundtable-on-sustainable-palm-oil	France	en:france			0																		"Sucre, huile de palme, NOISETTES (13%), cacao maigre (7,4%), LAIT écrémé en poudre (6,6%), LACTOSÉRUM en poudre, Émulsifiants : lécithines (SOJA), arôme (vanilline)."												"Lait, Fruits à coque, Soja"	en:milk,en:nuts,en:soybeans				100g	100g			546	kcal	31.6	g	11	g	57.6	g	56.8	g			6	g	0.11	g	0.044	g			546	kcal																																												en:lid	en:plastic					en:seal	en:aluminium					en:pot	en:glass					en:jar																			en:sweets	en:sugary-snacks,en:sweets	4	en:4-ultra-processed-food-and-drink-products	e	26	d	31		31032	-5	-14	0	0																App - yuka, Apps
80050698		fr					Nutella klein	Ferrero)		Nutella																					Nutella										200g	15 g	Bocal de verre, Couvercle en plastique, Opercule aluminium, Pot en verre	fr:bocal-de-verre,fr:couvercle-en-plastique,fr:opercule-aluminium,fr:pot-en-verre	ferrero,Nutella	ferrero,nutella		"Petit-déjeuners, Produits à tartiner, Produits à tartiner sucrés, Pâtes à tartiner, Pâtes à tartiner aux noisettes, Pâtes à tartiner au chocolat, Pâtes à tartiner aux noisettes et au cacao"	en:breakfasts,en:spreads,en:sweet-spreads,fr:pates-a-tartiner,en:hazelnut-spreads,en:chocolate-spreads,en:cocoa-and-hazelnuts-spreads	en:Sustainable, Huile de palme durable, Fabriqué dans l'UE, RSPO	en:sustainable,en:sustainable-palm-oil,en:made-in-the-eu,en:roundtable-on-sustainable-palm-oil	France, Allemagne, Suisse	en:france,en:germany,en:switzerland			0													"Zucker, palmöl, haselnüsse (13 %), fettarmer kakao (7.4 %), magermilchpulver (6.6 %), süßmolkenpulver, emulgator: lecithine (soja), vanillin."		Sugar, palm oil, hazelnuts (13%), lean cocoa (7.4%), skimmed milk powder (6.6%), whey powder, emulsifier: lecithins (soya), vanillin.			Sucre, Huile de palme, noisettes (13%), lait écrémé en poudre (8,7%), cacao maigre (7,4%), émulsifiant : lécithine (soja), vanilline.												"Lait, Fruits à coque, Soja"	en:milk,en:nuts,en:soybeans				100g	100g	2278	kJ	544	kcal	31.6	g	11	g	57.3	g	56.8	g			6	g	0.11	g	0.044	g			2278	kJ																																												en:lid	en:plastic					en:seal	en:aluminium					en:jar	en:glass					en:pot	en:glass																		en:sweets	en:sugary-snacks,en:sweets	4	en:4-ultra-processed-food-and-drink-products	e	26	d	39		31032	-5	-6	0	0																Database - FoodRepo / openfood.ch, Databases, App - yuka, Apps, App - Speisekammer
3760008851963		fr								Mini Muffins																															104g		Plastique	en:plastic	Nutella	nutella		Snacks, Snacks sucrés, Biscuits et gâteaux, Gâteaux, Muffins	en:snacks,en:sweet-snacks,en:biscuits-and-cakes,en:cakes,en:muffins			France	en:france			0																		"Sucre, fourrage à la pâte à tartiner aux NOISETTES 23,1% (sucre, huile de palme, NOISETTES 3%, LAIT écrémé en poudre, cacao maigre, émulsifiants : lécithines [SOJA], vanilline), farine de BLE, huile de colza, OEUF, blanc d'OEUF, eau, amidon modifié, LACTOSERUM en poudre, poudres à lever: E450i-E500ii, émulsifiant : E471, sel, gluten de BLE."												"Œufs, Gluten, Lait, Fruits à coque, Soja"	en:eggs,en:gluten,en:milk,en:nuts,en:soybeans	"Fruits à coque, Graines de sésame"	en:nuts,en:sesame-seeds		100g	100g	2075	kJ	464	kcal	27	g	5.4	g	52	g	38	g			3.6	g	0.84	g	0.336	g			2075	kJ																																													en:plastic																																				en:biscuits-and-cakes	en:sugary-snacks,en:biscuits-and-cakes	4	en:4-ultra-processed-food-and-drink-products	e	22	unknown				-5	-10	1	0	-10															App - yuka, Apps, App - Open Food Facts
3017620420443		fr								Nutella																															120 g ?		Plastique, Boîte, Carton	en:plastic,en:box,en:cardboard	Ferrero	ferrero		"Petit-déjeuners, Produits à tartiner, Produits à tartiner sucrés, Pâtes à tartiner, Pâtes à tartiner aux noisettes, Pâtes à tartiner au chocolat, Pâtes à tartiner aux noisettes et au cacao"	en:breakfasts,en:spreads,en:sweet-spreads,fr:pates-a-tartiner,en:hazelnut-spreads,en:chocolate-spreads,en:cocoa-and-hazelnuts-spreads	Sans gluten, Point Vert	en:no-gluten,en:green-dot	France	en:france			0																		sucre, huile de palme, NOISETTES 13 %, LAIT écrémé en poudre 8,7 %, cacao maigre 7,4 %, émulsifiants : lécithines (SOJA) ; vanilline. Sans gluten. 												"Lait, Fruits à coque, Soja"	en:milk,en:nuts,en:soybeans				100g	100g			539	kcal	30.9	g	10.6	g	57.5	g	56.3	g			6.3	g	0.107	g	0.0428	g			539	kcal																																												en:box	en:plastic						en:cardboard																														en:sweets	en:sugary-snacks,en:sweets	4	en:4-ultra-processed-food-and-drink-products	e	26	d	24		31032	-5	-11	1	0	-10															App - yuka, Apps
8000500228876	2021-01-21T15:40:52+01:00	fr								Nutella pate a tartiner noisettes-cacao																					"NUTELLA : Pâte à tartiner aux noisettes"										20 kg (20000 g)		Bocal	en:jar	Nutella	nutella		"Petit-déjeuners, Produits à tartiner, Produits à tartiner sucrés, Pâtes à tartiner, Pâtes à tartiner aux noisettes, Pâtes à tartiner au chocolat, Pâtes à tartiner aux noisettes et au cacao"	en:breakfasts,en:spreads,en:sweet-spreads,fr:pates-a-tartiner,en:hazelnut-spreads,en:chocolate-spreads,en:cocoa-and-hazelnuts-spreads			France	en:france			0																		"Sucre, huile de palme, NOISETTES 13%, LAIT écrémé en poudre 8,7%, cacao maigre
7,4%, émulsifiants : lécithines [ SOJA ] vanilline."												"Lait, Fruits à coque, Soja"	en:milk,en:nuts,en:soybeans			false	100g		2252	kJ	539	kcal	30.9	g	10.6	g	57.5	g	56.3	g			6.3	g	0.107	g	0.0428	g			2252	kJ																																												en:jar																																		"A conserver au sec et à l'abri de la chaleur. Ne pas mettre au réfrigérateur."	CS90058 76136 MONT-SAINT-AIGNAN		en:sweets	en:sugary-snacks,en:sweets	4	en:4-ultra-processed-food-and-drink-products	e	26	d	25		31032	-5	-10	0	0	-10							3010176200101	10000187	"Pâtes à Tartiner Sucrées (Longue Conservation)"			FERRERO FRANCE COMMERCIALE			Producers, Producer - ferrero-france-commerciale
3017620422027		fr								Nutella																					Nutella												Bocal	en:jar	ferrero	ferrero		"Petit-déjeuners, Produits à tartiner, Produits à tartiner sucrés, Pâtes à tartiner, Pâtes à tartiner aux noisettes, Pâtes à tartiner au chocolat, Pâtes à tartiner aux noisettes et au cacao"	en:breakfasts,en:spreads,en:sweet-spreads,fr:pates-a-tartiner,en:hazelnut-spreads,en:chocolate-spreads,en:cocoa-and-hazelnuts-spreads	Point Vert	en:green-dot	France	en:france			0																		Sucre, Huile de palme, NOISETTES 13%, LAIT écrémé en poudre 8,7%, cacao maigre 7,4%, émulsifiant : lécithine (SOJA), vanilline.												"Lait, Fruits à coque, Soja"	en:milk,en:nuts,en:soybeans				100g	100g			539	kcal	30.9	g	10.6	g	57.5	g	56.3	g			6.3	g	0.107	g	0.0428	g			539	kcal																																												en:jar																																					en:sweets	en:sugary-snacks,en:sweets	4	en:4-ultra-processed-food-and-drink-products	e	26	d	25		31032	-5	-10	0	0	-10															App - yuka, Apps
3017620423468		fr								nutella																															1000g		Pot 1000g	fr:pot-1000g	ferrero	ferrero		"Petit-déjeuners, Produits à tartiner, Produits à tartiner sucrés, Pâtes à tartiner, Pâtes à tartiner aux noisettes, Pâtes à tartiner au chocolat, Pâtes à tartiner aux noisettes et au cacao"	en:breakfasts,en:spreads,en:sweet-spreads,fr:pates-a-tartiner,en:hazelnut-spreads,en:chocolate-spreads,en:cocoa-and-hazelnuts-spreads	Sans gluten	en:no-gluten	France	en:france	carrefour	carrefour	0								l185hv	l185hv									sucre, huile de palme, NOISETTES 13%, LAIT écrémé en poudre 8,7%, cacao maigre 7,4%, émulsifiants: lécithines [soja												"Lait, Fruits à coque, Soja"	en:milk,en:nuts,en:soybeans				100g	100g			539	kcal	30.9	g	10.6	g	57.5	g	56.3	g	0	g	6.3	g	0.107	g	0.0428	g			539	kcal																																												en:pot																																					en:sweets	en:sugary-snacks,en:sweets	4	en:4-ultra-processed-food-and-drink-products	e	26	d	25		31032	-5	-10	0	0	-10															
80762003		fr								Nutella																															400 G	100g	Plastique, Verre	en:plastic,en:glass	Ferrero	ferrero		"Petit-déjeuners, Produits à tartiner, Produits à tartiner sucrés, Pâtes à tartiner, Pâtes à tartiner aux noisettes, Pâtes à tartiner au chocolat, Pâtes à tartiner aux noisettes et au cacao"	en:breakfasts,en:spreads,en:sweet-spreads,fr:pates-a-tartiner,en:hazelnut-spreads,en:chocolate-spreads,en:cocoa-and-hazelnuts-spreads			Belgique, France, Suisse	en:belgium,en:france,en:switzerland			0																		Sucre, huile de palme, NOISETTES 13%, LAIT écrémé en poudre 8.7%, cacao maigre 7,4%, émulsifiants: lécithines [SOJA] ; vanilline.												"Lait, Fruits à coque, Soja"	en:milk,en:nuts,en:soybeans				100g	100g	2252	kJ	539	kcal	30.9	g	10.6	g	57.5	g	56.3	g	0	g	6.3	g	0.107	g	0.0428	g			2252	kJ																																													en:plastic						en:glass																														en:sweets	en:sugary-snacks,en:sweets	4	en:4-ultra-processed-food-and-drink-products	e	26	d	23		31032	-5	-12	1	0	-10															
3018320422003		fr								nutella																																						"Petit-déjeuners, Produits à tartiner, Produits à tartiner sucrés, Pâtes à tartiner, Pâtes à tartiner aux noisettes, Pâtes à tartiner au chocolat, Pâtes à tartiner aux noisettes et au cacao"	en:breakfasts,en:spreads,en:sweet-spreads,fr:pates-a-tartiner,en:hazelnut-spreads,en:chocolate-spreads,en:cocoa-and-hazelnuts-spreads			Belgique	en:belgium			0																		sucre, huile de palme, NOISETTES 13%, LAIT écrémé en poudre 8,7%, cacao maigre 7,4%, emulsifiants: lecithines [SOJA]; vanilline.												"Lait, Fruits à coque, Soja"	en:milk,en:nuts,en:soybeans				100g	100g																																																																																																									en:sweets	en:sugary-snacks,en:sweets	4	en:4-ultra-processed-food-and-drink-products	unknown		d	20	1	31032	-5	-15	1	0	-10															App - smoothie-openfoodfacts, Apps
