code	producer_version_id	lc	product_name_ar	product_name_bg	product_name_bn	product_name_ch	product_name_de	product_name_en	product_name_es	product_name_fr	product_name_hi	product_name_hr	product_name_hu	product_name_it	product_name_nl	product_name_pl	product_name_pt	product_name_ro	product_name_ru	product_name_sr	product_name_sv	product_name_th	product_name_xx	product_name_zh	abbreviated_product_name_fr	generic_name_ar	generic_name_ch	generic_name_de	generic_name_en	generic_name_es	generic_name_fr	generic_name_hu	generic_name_it	generic_name_nl	generic_name_pl	generic_name_pt	generic_name_ro	generic_name_ru	generic_name_th	generic_name_zh	quantity	serving_size	packaging	packaging_tags	brands	brands_tags	brand_owner	categories	categories_tags	labels	labels_tags	countries	countries_tags	stores	stores_tags	obsolete	obsolete_since_date	origins	origins_tags	origin_ch	origin_en	manufacturing_places	manufacturing_places_tags	emb_codes	emb_codes_tags	ingredients_text_ar	ingredients_text_bg	ingredients_text_ch	ingredients_text_de	ingredients_text_el	ingredients_text_en	ingredients_text_es	ingredients_text_et	ingredients_text_fr	ingredients_text_hi	ingredients_text_hr	ingredients_text_hu	ingredients_text_it	ingredients_text_nl	ingredients_text_pl	ingredients_text_pt	ingredients_text_ro	ingredients_text_sv	ingredients_text_th	ingredients_text_xx	allergens	allergens_tags	traces	traces_tags	no_nutrition_data	nutrition_data_per	nutrition_data_prepared_per	energy-kj_value	energy-kj_unit	energy-kcal_value	energy-kcal_unit	fat_value	fat_unit	saturated-fat_value	saturated-fat_unit	carbohydrates_value	carbohydrates_unit	sugars_value	sugars_unit	fiber_value	fiber_unit	proteins_value	proteins_unit	salt_value	salt_unit	sodium_value	sodium_unit	alcohol_value	alcohol_unit	energy_value	energy_unit	energy-from-fat_value	energy-from-fat_unit	arachidic-acid_value	arachidic-acid_unit	monounsaturated-fat_value	monounsaturated-fat_unit	polyunsaturated-fat_value	polyunsaturated-fat_unit	alpha-linolenic-acid_value	alpha-linolenic-acid_unit	trans-fat_value	trans-fat_unit	cholesterol_value	cholesterol_unit	added-sugars_value	added-sugars_unit	vitamin-a_value	vitamin-a_unit	vitamin-d_value	vitamin-d_unit	vitamin-e_value	vitamin-e_unit	vitamin-c_value	vitamin-c_unit	vitamin-b2_value	vitamin-b2_unit	potassium_value	potassium_unit	calcium_value	calcium_unit	phosphorus_value	phosphorus_unit	iron_value	iron_unit	magnesium_value	magnesium_unit	selenium_value	selenium_unit	fruits-vegetables-nuts-estimate_value	fruits-vegetables-nuts-estimate_unit	cocoa_value	cocoa_unit	packaging_1_number_of_units	packaging_1_shape	packaging_1_material	packaging_1_recycling	packaging_1_quantity_per_unit	packaging_1_weight_measured	packaging_2_number_of_units	packaging_2_shape	packaging_2_material	packaging_2_recycling	packaging_2_quantity_per_unit	packaging_2_weight_measured	packaging_3_number_of_units	packaging_3_shape	packaging_3_material	packaging_3_recycling	packaging_3_quantity_per_unit	packaging_3_weight_measured	packaging_4_number_of_units	packaging_4_shape	packaging_4_material	packaging_4_recycling	packaging_4_quantity_per_unit	packaging_4_weight_measured	packaging_5_number_of_units	packaging_5_shape	packaging_5_material	packaging_5_recycling	packaging_5_quantity_per_unit	packaging_5_weight_measured	packaging_6_shape	packaging_6_material	packaging_7_material	packaging_7_recycling	packaging_8_material	conservation_conditions_fr	customer_service_fr	link	off:food_groups	off:food_groups_tags	off:nova_groups	off:nova_groups_tags	off:nutriscore_grade	off:nutriscore_score	off:ecoscore_grade	off:ecoscore_score	off:ecoscore_data.missing_key_data	off:ecoscore_data.agribalyse.code	off:ecoscore_data.adjustments.origins_of_ingredients.value	off:ecoscore_data.adjustments.packaging.value	off:ecoscore_data.adjustments.packaging.non_recyclable_and_non_biodegradable_materials	off:ecoscore_data.adjustments.production_system.value	off:ecoscore_data.adjustments.threatened_species.value	sources_fields:org-database-usda:available_date	sources_fields:org-database-usda:fdc_category	sources_fields:org-database-usda:fdc_data_source	sources_fields:org-database-usda:fdc_id	sources_fields:org-database-usda:modified_date	sources_fields:org-database-usda:publication_date	sources_fields:org-gs1:gln	sources_fields:org-gs1:gpcCategoryCode	sources_fields:org-gs1:gpcCategoryName	sources_fields:org-gs1:isAllergenRelevantDataProvided	sources_fields:org-gs1:lastChangeDateTime	sources_fields:org-gs1:partyName	sources_fields:org-gs1:productionVariantDescription	sources_fields:org-gs1:publicationDateTime	data_sources
8000500227848	2014	en					NutellaB-ready		Nutella B-ready	Biscuits Nutella B-ready x6 gaufrettes fourrées - 132g				Nutella B-ready								"นูเทลล่า บี-เรดี้"			Nutella b-ready t6				Wafer filled with hazelnut spread with cocoa		"Spécialité croustillante fourrée à la pâte à tartiner aux noisettes et au cacao NUTELLA et aux éclats croustillants"								"นูเทลล่าเวเฟอร์สอดไส้ช็อกโกแลตฮาเซลนัต"		132g	22g	Plastic, Cardboard, PP 5 - Polypropylene, Non-corrugated cardboard, Green dot, Kunststoff-Folie, Papp-Schachtel, Card-box	en:plastic,en:cardboard,en:pp-5-polypropylene,en:non-corrugated-cardboard,en:green-dot,en:kunststoff-folie,en:papp-schachtel,en:card-box	"Nutella, นูเทลล่า"	"nutella,นูเทลล่า"		Snacks, Sweet snacks, Cocoa and its products, Confectioneries, Bars, Biscuits and cakes, Biscuits, Wafers, Stuffed wafers, Hazelnut cream stuffed wafers	en:snacks,en:sweet-snacks,en:cocoa-and-its-products,en:confectioneries,en:bars,en:biscuits-and-cakes,en:biscuits,en:wafers,en:stuffed-wafers,en:hazelnut-cream-stuffed-wafers	No artificial preservatives, Green Dot, No artificial colors, No artificial colours and preservatives, Triman	en:no-artificial-preservatives,en:green-dot,en:no-artificial-colors,en:no-artificial-colours-and-preservatives,fr:triman	Belgium, France, Germany, Italy, Luxembourg, Martinique, Mauritius, Morocco, New Caledonia, Réunion, Spain, Switzerland, Thailand, United Kingdom	en:belgium,en:france,en:germany,en:italy,en:luxembourg,en:martinique,en:mauritius,en:morocco,en:new-caledonia,en:reunion,en:spain,en:switzerland,en:thailand,en:united-kingdom	Penny,Rewe,Lidl	penny,rewe,lidl	0													"Nuss-Nugat-Creme 81,5 % (Zucker, Palmöl, HASELNÜSSE (13 %), MAGERMILCHPULVER (8,7 %), fettarmer Kakao, Emulgator Lecithine (SOJA), Vanillin), Waffel 16 % (WEIZENMEHL, Backhefe, GERSTENMALZEXTRAKT, Salz, MAGERMILCHPULVER, Emulgator Lecithine (SOJA), WEIZENKLEBER, MILCHEIWEISS), WEIZENCRISP 2 % (WEIZENMEHL, GERSTENMALZEXTRAKT, Backhefe, Salz, MAGERMILCHPULVER, Emulgator Lecithine (SOJA), WEIZENKLEBER, MILCHEIWEISS)."	"nutella B-ready (PL) Ferrero Polska Commercial Sp, z o,o,, ul, Wiertnicza 126, 02-952 Warszawa, (EST) Turustaja: AS Mobec, Kurekivi tee 6, Lehmja küla, Rae vald, Harjumaa, Eesti, (GR) (CY) FERRERO INTERNATIONAL S,A, GREECE ΜΟΝ, ΕΠΕ: ΑΡΤΕΜΙΔΟΣ 3 Τ,Κ, 15125, ΜΑΡΟΥΣΙ, ΤΗΛ,2122223784, ΕΛΛΑΔΑ, ΔΙΑΝΟΜΕΙΣ ΓΙΑ ΤΗΝ ΚΥΠΡΟ: ΚΥΠΡΟΦΑΡΜ ΛΤΔ ΤΗΛ,22434699 ΛΕΥΚΩΣΙΑ, | 8 000500 227848"	hazelnut  spread with cocoa 81,5% (sugar, palm oil,  hazelnuts  (13%), skimmed  milk  powder (8,7%), fat-reduced cocoa (7,4%), emulsifier: lecithin ( soya ), vanillin),  wheat  flour (16%), baker's yeast, powdered  barley 's malt extract, salt, skimmed  milk  powder, emulsifier: lecithin ( soya ),  wheat  proteins, whey proteins ( milk ), water,			"Pâte à tartiner aux noisettes et au cacao 81,5 % (sucre, huile de palme, noisettes 13%, lait écrémé en poudre 8,7%, cacao maigre 7,4%, émulsifiants : lécithines [soja] ; vanilline), farine de froment , levure de bière, extrait de malt d'orge, sel, lait écrémé en poudre, émulsifiants : lécithines [soja] ; protéines de froment, protéines de lait."				crema alle NOCCIOLE e al cacao 81,5% (zucchero, olio di palma, NOCCIOLE 13%**, LATTE scremato in polvere 8,7%**, cacao magro 7,4%**, emulsionanti: lecitine (SOIA); vanillina), farina di GRAN0 tenero tipo 00 16%, lievito di birra, estratto di malto d'ORZO, sale, LATTE scremato in polvere, emulsionanti: lecitine (SOIA); proteine di FRUMENTO, proteine del LATTE.						"น้ำตาล 40.5%, ไขมันพืช 17.3%, แป้งสาลี 16.3%, เฮเซลนัท 9.9%, นมผงขาดมันเนย 7.5%, ผงโกโก้ลดไขมัน 6% ส่วนประกอบที่น้อยกว่า 2% ผงมอลต์สกัดจากข้าวบาร์เลย์ เกลือ โปรตีนจากข้าวสาลี เวย์โปรตีนเข้มข้น วัตถุเจือปนอาหาร (เลซิติน (ถั่วเหลือง) แต่งกลิ่นเลียนธรรมชาติ ข้อมูลสำหรับผู้แพ้อาหาร: มีนม ข้าวสาลี บาร์เลย์ เฮเซลนท และถั่วเหลือง"		Gluten, Milk, Nuts, Soybeans	en:gluten,en:milk,en:nuts,en:soybeans				100g	100g	2177	kJ	521	kcal	27	g	9.5	g	60.7	g	47.1	g			7.2	g	0.559	g	0.2236	g			2177	kJ																																												en:sleeve	en:non-corrugated-cardboard					en:box	en:pp-5-polypropylene																											"A conserver au sec et à l'abri de la chaleur"	FERRERO FRANCE COMMERCIALE - Service Consommateurs, CS 90058 - 76136 MONT SAINT AIGNAN Cedex	https://www.nutella.com/uk/en/products/b-ready	en:biscuits-and-cakes	en:sugary-snacks,en:biscuits-and-cakes	4	en:4-ultra-processed-food-and-drink-products	e	27	d	30		24312	-5	-9	0	0	-10							3010176200101	10000045	Chocolat et Confiserie de Chocolat et/ou de Sucre - Confiserie	true	2024-03-16T02:46:53+01:00	FERRERO FRANCE COMMERCIALE	2014	2024-03-16T02:46:53+01:00	Database - FoodRepo / openfood.ch, Databases, Producer - Ferrero, Producers, App - yuka, Apps, Producer - ferrero-france-commerciale, App - InFood, App - Open Food Facts, App - Speisekammer, Database - Equadis, Database - GDSN, App - smoothie-openfoodfacts
8000500223369	2014	fr								Biscuits Nutella B-ready x15 gaufrettes fourrées - 330g															Nutella b-ready t15						"Spécialité croustillante fourrée à la pâte à tartiner aux noisettes et au cacao Nutella® et aux éclats croustillants (2%)"										330 g	22 g (22)	Boite en carton, Emballage en plastique, Triman	fr:boite-en-carton,fr:emballage-en-plastique,fr:triman	Ferrero,Nutella b-ready	ferrero,nutella-b-ready		Snacks, Snacks sucrés, Biscuits et gâteaux, Biscuits, en:Barres, en:Barres chocolatées, en:Barres chocolatées biscuitées, en:Biscuits et gâteaux, en:Cacao et dérivés, en:Confiseries, en:Confiseries chocolatées, en:Snacks sucrés	en:snacks,en:sweet-snacks,en:biscuits-and-cakes,en:biscuits,en:barres,en:barres-chocolatees,en:barres-chocolatees-biscuitees,en:biscuits-et-gateaux,en:cacao-et-derives,en:confiseries,en:confiseries-chocolatees,en:snacks-sucres	Triman	fr:triman	France	en:france	Carrefour Market,Carrefour City,Auchan,E.leclerc	carrefour-market,carrefour-city,auchan,e-leclerc	0															hazelnut and cocoa spread 81.5% (sugar, palm oil, hazelnuts 13%, skimmed milk powder 8.7%, lean cocoa 7.4%, emulsifiers: lecithins [soy] , vanillin), wheat flour 16%, beer yeast, barley malt extract, salt, skimmed milk powder, emulsifiers: lecithins [soy] , wheat protein, milk protein, water protein,			"Pâte à tartiner aux noisettes et au cacao 81,5 % (sucre, huile de palme, noisettes 13%, lait écrémé en poudre 8,7%, cacao maigre 7,4%, émulsifiants : lécithines [soja] ; vanilline), farine de froment 16%, levure de bière, extrait de malt d'orge, sel, lait écrémé en poudre, émulsifiants : lécithines [soja] ; protéines de froment, protéines de lait, eau."												"Gluten, Lait, Fruits à coque, Soja"	en:gluten,en:milk,en:nuts,en:soybeans				100g	100g	2177	kJ	521	kcal	27	g	9.5	g	60.7	g	47.1	g	0	g	7.2	g	0.559	g	0.2236	g			2177	kJ																																											15	en:packaging	en:plastic	en:recycle		0.7	1	en:box	en:cardboard	en:recycle		33.3																								"A conserver au sec et à l'abri de la chaleur"	FERRERO FRANCE COMMERCIALE - Service Consommateurs, CS 90058 - 76136 MONT SAINT AIGNAN Cedex		en:biscuits-and-cakes	en:sugary-snacks,en:biscuits-and-cakes	4	en:4-ultra-processed-food-and-drink-products	e	27	c	44		24000	-5	-11	1	0	-10							3010176200101	10000045	Chocolat et Confiserie de Chocolat et/ou de Sucre - Confiserie	true	2024-03-16T02:26:28+01:00	FERRERO FRANCE COMMERCIALE	2014	2024-03-16T02:26:28+01:00	Producer - Ferrero, Producers, App - off, App - yuka, Apps, Producer - ferrero-france-commerciale, Database - Equadis, Database - GDSN, Databases, App - Horizon, App - InFood, App - Open Food Facts, App - smoothie-openfoodfacts
8000500370681	2021-01-14T00:03:36+01:00	fr								NUTELLA BISCUITS 304g sachet de 22 pièces offre spéciale															Nutella biscuits t22						"Biscuits fourrés à la pâte à tartiner aux noisettes et au cacao Nutella®"										304 g	13.8 g (1)	Enveloppe	en:envelope	Nutella biscuits	nutella-biscuits		Snacks, Snacks sucrés, Surgelés, Biscuits et gâteaux, Biscuits	en:snacks,en:sweet-snacks,en:frozen-foods,en:biscuits-and-cakes,en:biscuits			France	en:france			0																		"Pâte à tartiner aux NOISETTES et au cacao 40% (sucre, huile de palme, NOISETTES 13%, LAIT écrémé en poudre 8,7%, cacao maigre 7,4%, émulsifiants : lécithines [SOJA] ; vanilline), farine de FROMENT 32%, graisses végétales (palme, palmiste), sucre de canne 9%, LACTOSE, son de BLE, LAIT en poudre, extrait en poudre de malt d'ORGE et de maïs, miel, poudres à lever (disphosphate disodique, carbonate acide d'ammonium, carbonate acide de sodium), cacao maigre, sel, amidon de FROMENT, farine d'ORGE malté, émulsifiants : lécithines [SOJA] ; vanilline."												"Gluten, Lait, Fruits à coque, Soja, Gs1:T4078:ML"	en:gluten,en:milk,en:nuts,en:soybeans,fr:gs1-t4078-ml				100g	100g	2158	kJ	515	kcal	24.8	g	11.5	g	64	g	35.8	g			7.9	g	0.559	g	0.2236	g			2158	kJ																																												en:envelope																																		"A conserver au sec et à l'abri de la chaleur. Ne pas mettre au réfrigérateur."	FERRERO FRANCE COMMERCIALE - Service Consommateurs, CS 90058 - 76136 MONT SAINT AIGNAN Cedex	https://www.nutella.com/fr/fr/produits/nutella-biscuits	en:biscuits-and-cakes	en:sugary-snacks,en:biscuits-and-cakes	4	en:4-ultra-processed-food-and-drink-products	e	25	c	54		24000	-5	-1	0	0	-10							3010176200101	10000161	Gâteaux Secs/Biscuits (Longue Conservation)	true	2024-03-15T23:17:15+01:00	FERRERO FRANCE COMMERCIALE		2024-03-15T23:17:15+01:00	Producers, Producer - ferrero-france-commerciale, Database - Equadis, Database - GDSN, Databases, App - yuka, Apps
3017620425035	2014	fr					Nutella	Nutella		Nutella														"费列罗榛子巧克力酱"	Nutella t.1000				Spread with hazelnuts		"Pâte à tartiner aux noisettes"									"榛子巧克力酱"	1 kg	15 g	Composites multicouches, Plastique, Carton, Verre, PP 5 - Polypropylène, Verre transparent, Carton non ondulé, 82 C/X, 82 C/PAP, en:Bocal	en:composite-material,en:plastic,en:cardboard,en:glass,en:pp-5-polypropylene,en:clear-glass,en:non-corrugated-cardboard,en:paper-and-fibreboard-aluminium,xx:82-c-pap,en:bocal	Ferrero	ferrero		"Petit-déjeuners, Matières grasses, Produits à tartiner, Produits à tartiner sucrés, Pâtes à tartiner, Pâtes à tartiner aux noisettes, Pâtes à tartiner au chocolat, Pâtes à tartiner aux noisettes et au cacao"	en:breakfasts,en:fats,en:spreads,en:sweet-spreads,fr:pates-a-tartiner,en:hazelnut-spreads,en:chocolate-spreads,en:cocoa-and-hazelnuts-spreads	Sans gluten, Sans conservateurs, Sans colorants, Sans matière grasse hydrogénée, Triman, SGS	en:no-gluten,en:no-preservatives,en:no-colorings,en:no-hydrogenated-fats,fr:triman,fr:sgs	"Algérie, Belgique, France, Allemagne, Guadeloupe, Italie, Luxembourg, Martinique, Maroc, La Réunion, Espagne, Suisse, Tunisie, Royaume-Uni, États-Unis"	en:algeria,en:belgium,en:france,en:germany,en:guadeloupe,en:italy,en:luxembourg,en:martinique,en:morocco,en:reunion,en:spain,en:switzerland,en:tunisia,en:united-kingdom,en:united-states	Auchan,E. Leclerc,Carrefour	auchan,e-leclerc,carrefour	0						France	france								sugar, palm oil, hazelnuts 13%, skim milk powder 8,7%, lean cocoa 7,4%, emulsifiers: lecithins [ soy ] vanillin, gluten-free			Sucre, huile de palme, NOISETTES 13%, LAIT écrémé en poudre 8,7%, cacao maigre 7,4%, émulsifiants: lécithines [SOJA]; vanilline. Sans gluten												"Lait, Fruits à coque, Soja"	en:milk,en:nuts,en:soybeans				100g	100g	2252	kJ	539	kcal	30.9	g	10.6	g	57.5	g	56.3	g	0	g	6.3	g	0.107	g	0.0428	g			2252	kJ																																											1	en:seal	xx:82-c-pap	en:recycle		0.3	1	en:lid	en:pp-5-polypropylene	en:recycle		8	1	en:jar	en:clear-glass	en:recycle-in-glass-bin		443	1	en:backing	en:non-corrugated-cardboard	en:recycle		2.2	2	en:label	en:paper	en:recycle		0.1						"A conserver au sec et à l'abri de la chaleur. Ne pas mettre au réfrigérateur."	FERRERO FRANCE COMMERCIALE - Service Consommateurs, CS 90058 - 76136 MONT SAINT AIGNAN Cedex	https://www.nutella.com/fr/fr/produits/nutella	en:sweets	en:sugary-snacks,en:sweets	4	en:4-ultra-processed-food-and-drink-products	e	21	d	31		31032	-5	-5	0	0	-10							3010176200101	10000187	"Pâtes à Tartiner Sucrées (Longue Conservation)"	true	2024-03-15T22:53:48+01:00	FERRERO FRANCE COMMERCIALE	2014	2024-03-15T22:53:48+01:00	Producer - Ferrero, Producers, App - off, App - yuka, Apps, Producer - ferrero-france-commerciale, Database - Equadis, Database - GDSN, Databases, App - InFood, App - Open Food Facts, App - smoothie-openfoodfacts
8000500264850	2014	en						Nutella Be-Ready	"Nutella Be-Ready ×2"	Biscuits Nutella B-ready x2 gaufrettes fourrées - 44g							Snack Nutella Bready T2								Nutella b-ready t2						"Spécialité croustillante fourrée à la pâte à tartiner aux noisettes et au cacao Nutella® et aux éclats croustillants (2%)."										44 g	22 g (Portion)	Plastic, Bag, Box	en:plastic,en:bag,en:box	NUTELLA,FERRERO, Mixte, Nutella b-ready	nutella,ferrero,mixte,nutella-b-ready		"Snacks, Breakfasts, Spreads, Sweet snacks, Sweet spreads, Biscuits and cakes, Biscuits, Chocolate biscuits, fr:Pâtes à tartiner, Hazelnut spreads"	en:snacks,en:breakfasts,en:spreads,en:sweet-snacks,en:sweet-spreads,en:biscuits-and-cakes,en:biscuits,en:chocolate-biscuits,fr:pates-a-tartiner,en:hazelnut-spreads			Bulgaria, France	en:bulgaria,en:france			0															chocolate spread with hazelnuts and cocoa for 81,5 % (sugar, palm oil, hazelnuts 13%, skimmed milk powder 8,7%, lean cocoa is 7,4%, emulsifiers : lecithins [soy] , vanillin), wheat flour 16%, yeast of beer, malt extract, salt, skimmed milk powder, emulsifiers : lecithins [soy] , protein, wheat, milk proteins, water,			"Pâte à tartiner aux NOISETTES et au cacao 81,5% (sucre, huile de palme, NOISETTES 13%**, LAIT écrémé en poudre 8,7%**, cacao maigre 7,4%**, émulsifiants : lécithines [SOJA] ; vanilline), farine de FROMENT 16%, levure de bière, extrait de malt d'ORGE, sel, LAIT écrémé en poudre, émulsifiants : lécithines [SOJA] ; protéines de FROMENT, protéines de LAIT.**Correspond à 10,6% de noisettes, 7% de lait écrémé en poudre et 6% de cacao maigre dans le produit fini."												Gluten, Milk, Nuts, Soybeans	en:gluten,en:milk,en:nuts,en:soybeans				100g	100g	2177	kJ	521	kcal	27	g	9.5	g	60.7	g	47.1	g			7.2	g	0.559	g	0.2236	g			2177	kJ																																												en:bag	en:plastic					en:box																												"A conserver au sec et à l'abri de la chaleur."	FERRERO FRANCE COMMERCIALE - Service Consommateurs, CS 90058 - 76136 MONT SAINT AIGNAN Cedex		en:biscuits-and-cakes	en:sugary-snacks,en:biscuits-and-cakes	4	en:4-ultra-processed-food-and-drink-products	e	27	d	21		31032	-5	-15	1	0	-10							3010176200101	10000045	Chocolat et Confiserie de Chocolat et/ou de Sucre - Confiserie	true	2024-03-15T07:40:34+01:00	FERRERO FRANCE COMMERCIALE	2014	2024-03-15T07:40:34+01:00	Producer - Ferrero, Producers, App - yuka, Apps, Producer - ferrero-france-commerciale, Database - Equadis, Database - GDSN, Databases, App - InFood, App - smoothie-openfoodfacts
80050100	2014	en					Nutella & Go			Biscuits Nutella & Go boîte - 52g							"Snack Chocolate 🍫 Nutella e Go 52g"								Nutella & go t.1				Hazelnut spread with breadsticks		"En-cas composé de pâte à tartiner aux noisettes et au cacao et de bâtonnets céréaliers"										52 g	52 g (Nutella 39 g et 13 g batonnet)	Plastic, Box	en:plastic,en:box	Ferrero, Nutella, Mixte, Nutella & go	ferrero,nutella,mixte,nutella-go		"Snacks, Breakfasts, Spreads, Sweet snacks, Sweet spreads, fr:Pâtes à tartiner, Hazelnut spreads, Chocolate spreads, Cocoa and hazelnuts spreads"	en:snacks,en:breakfasts,en:spreads,en:sweet-snacks,en:sweet-spreads,fr:pates-a-tartiner,en:hazelnut-spreads,en:chocolate-spreads,en:cocoa-and-hazelnuts-spreads	Green Dot, Made in Germany	en:green-dot,en:made-in-germany	Belgium, France, Germany, Switzerland	en:belgium,en:france,en:germany,en:switzerland	Aldi	aldi	0						Allemagne,Italie	allemagne,italie						"Zucker, Palmöl, _HASELNÜSSE_ (13%), _MAGERMILCHPULVER_ (8,7 %), fettarmer Kakao, Emulgator Lecithine (_SOJA_), Vanillin. _WEIZENMEHL_, Palmöl, Salz, _GERSTENMALZEXTRAKTPULVER_, Backhefe."		Zucker, Palmöl, HASELNUSSES TO MAGERMILCHPULVER Kakao (7,4%), Emigator Vanillin. Brot-Sticks: Zutaten Palmöl, Salz, GERSTENMALZENTRANT PULVER (1,3%), Backhefe. Kann SCIA SENF und LUPINEN enthalten. 8005 0100&quot; 24 12 25 8 nutella.com Consumer Service DE +49 69/665 666-0 Mo.-Fr. 8:30-17:30 Uhr Optimale Aufbewahrung zwischen 18°C und 24°C.			Null												Gluten, Milk, Nuts, Soybeans, de:GERSTENMALZEXTRAKTPULVER	en:gluten,en:milk,en:nuts,en:soybeans,de:gerstenmalzextraktpulver	Lupin, Soybeans, Moutarde	en:lupin,en:soybeans,en:moutarde	null	100g	100g	1105	kJ	264	kcal	13.1	g	4.7	g	32	g	22.7	g			3.8	g	0.317	g	0.1268	g			1105	kJ																																												en:box	en:plastic																																		FERRERO FRANCE COMMERCIALE - Service Consommateurs, CS 90058 - 76136 MONT SAINT AIGNAN Cedex		en:sweets	en:sugary-snacks,en:sweets		unknown	d	13	d	36		31032	-5	-10	1	0								3010176200101	10000045	Chocolat et Confiserie de Chocolat et/ou de Sucre - Confiserie	true	2024-03-15T07:21:23+01:00	FERRERO FRANCE COMMERCIALE	2014	2024-03-15T07:21:23+01:00	Database - FoodRepo / openfood.ch, Databases, Producer - Ferrero, Producers, App - yuka, Apps, Producer - ferrero-france-commerciale, Database - Equadis, Database - GDSN, App - InFood, App - Open Food Facts, App - Speisekammer, App - smoothie-openfoodfacts
